{
    "name": "aws-cloudtrail",
    "version": "1.0.0",
    "description": "AWS CloudTrail event templates for management and data events",
    "maintainers": [
      {
        "name": "LogForge Community",
        "email": "community@logforge.dev"
      }
    ],
    "tags": [
      "aws",
      "cloud",
      "audit",
      "compliance",
      "security",
      "api-activity"
    ],
    "templates": [
      "management/delete_trail.j2",
      "management/iam_delete_policy.j2",
      "management/ec2_create_snapshot.j2"
    ]
  }