{
"name":"defender-for-identity",
"version":"1.0.0",
"description":"MicrosoftDefenderforIdentitysecurityalertandthreatdetectiontemplates",
"maintainers":[
{
"name":"LogForgeCommunity",
"email":"community@logforge.com"
}
],
"tags":["microsoft","defender","identity","security","alerts","atp","activedirectory","kerberos"],
"templates":[
"security-alerts/pass_the_ticket"
]
}