{
    "name": "sentinelone-complete",
    "version": "1.0.0",
    "description": "SentinelOne Complete Platform security event templates",
    "maintainers": [
      {
        "name": "LogForge Community"
      }
    ],
    "tags": [
      "security",
      "edr",
      "endpoint-protection",
      "threat-detection",
      "incident-response"
    ],
    "templates": [
      "security/threat_detection.j2"
    ]
  }