{
    "name": "azure-active-directory",
    "version": "1.0.0",
    "description": "Microsoft Azure Active Directory authentication and identity management event templates",
    "maintainers": [
      {
        "name": "LogForge Community",
        "email": "community@logforge.com"
      }
    ],
    "tags": ["microsoft", "azure", "active-directory", "authentication", "signin", "identity", "mfa", "conditional-access"],
    "templates": [
      "authentication/signin_logs.j2"
    ]
  }